{
  "version": "1.0",
  "last_updated": "2026-01-07T10:47:23Z",
  "sessions": [
    {
      "session_id": "550e8400-e29b-41d4-a716-446655440000",
      "timestamp": "2026-01-07T10:12:07Z",
      "feature_summary": "OAuth authentication implementation",
      "total_tasks": 12,
      "ordering_strategy": {
        "primary_approach": "foundational_first",
        "grouping_method": "by_dependency",
        "parallelization_level": "high"
      },
      "task_groups": [
        {
          "group_id": "P:Group-1",
          "order": 1,
          "task_count": 3,
          "parallel": false,
          "dependencies": [],
          "grouping_rationale": "Foundational tasks: database schema must exist before any data access, session storage config required before auth can work",
          "risk_level": "low"
        },
        {
          "group_id": "P:Group-2",
          "order": 2,
          "task_count": 4,
          "parallel": true,
          "dependencies": ["P:Group-1"],
          "grouping_rationale": "Backend tasks with no dependencies on each other. Can build routes, middleware, and services in parallel once database is ready",
          "risk_level": "medium"
        },
        {
          "group_id": "P:Group-3",
          "order": 3,
          "task_count": 3,
          "parallel": true,
          "dependencies": ["P:Group-2"],
          "grouping_rationale": "Frontend UI tasks that depend on backend API contract. Can build different UI components in parallel",
          "risk_level": "low"
        },
        {
          "group_id": "P:Group-4",
          "order": 4,
          "task_count": 2,
          "parallel": false,
          "dependencies": ["P:Group-2", "P:Group-3"],
          "grouping_rationale": "Integration and testing must come after implementation. End-to-end tests need both frontend and backend complete",
          "risk_level": "medium"
        }
      ],
      "critical_path": [
        "database-schema",
        "session-storage-config",
        "auth-routes",
        "oauth-ui",
        "integration-tests"
      ],
      "dependency_analysis": {
        "total_dependencies": 18,
        "max_depth": 4,
        "bottleneck_tasks": [
          "database-schema",
          "auth-routes"
        ]
      },
      "outcome": {
        "all_tasks_completed": true,
        "reordering_required": false,
        "blocking_issues": 0,
        "parallel_efficiency": 0.87,
        "lessons_learned": "Foundational-first approach worked well. Group-2 parallel execution saved significant time. No blocking dependencies encountered."
      }
    },
    {
      "session_id": "440e8400-e29b-41d4-a716-446655440001",
      "timestamp": "2026-01-06T14:15:30Z",
      "feature_summary": "User profile management",
      "total_tasks": 8,
      "ordering_strategy": {
        "primary_approach": "risk_early",
        "grouping_method": "by_risk",
        "parallelization_level": "medium"
      },
      "task_groups": [
        {
          "group_id": "P:Group-1",
          "order": 1,
          "task_count": 2,
          "parallel": false,
          "dependencies": [],
          "grouping_rationale": "High-risk database migration done first to allow early rollback if issues arise",
          "risk_level": "high"
        },
        {
          "group_id": "P:Group-2",
          "order": 2,
          "task_count": 3,
          "parallel": true,
          "dependencies": ["P:Group-1"],
          "grouping_rationale": "Medium-risk backend and frontend tasks can proceed in parallel after database is stable",
          "risk_level": "medium"
        },
        {
          "group_id": "P:Group-3",
          "order": 3,
          "task_count": 3,
          "parallel": true,
          "dependencies": ["P:Group-2"],
          "grouping_rationale": "Lower-risk testing and documentation tasks",
          "risk_level": "low"
        }
      ],
      "critical_path": [
        "database-migration",
        "profile-api",
        "profile-ui"
      ],
      "dependency_analysis": {
        "total_dependencies": 10,
        "max_depth": 3,
        "bottleneck_tasks": [
          "database-migration"
        ]
      },
      "outcome": {
        "all_tasks_completed": true,
        "reordering_required": false,
        "blocking_issues": 1,
        "parallel_efficiency": 0.75,
        "lessons_learned": "Risk-early approach prevented late-stage failures. Database migration issue caught and resolved early. Would use same strategy again."
      }
    }
  ],
  "patterns": {
    "effective_patterns": [
      {
        "pattern": "Database schema and foundational configuration first",
        "success_rate": 0.96,
        "applicable_scenarios": [
          "Features requiring data persistence",
          "Features with external service integration",
          "Features needing new infrastructure"
        ]
      },
      {
        "pattern": "Backend API before frontend UI",
        "success_rate": 0.94,
        "applicable_scenarios": [
          "API-driven features",
          "Full-stack implementations",
          "Features with complex business logic"
        ]
      },
      {
        "pattern": "High-risk tasks early in execution order",
        "success_rate": 0.91,
        "applicable_scenarios": [
          "Features with database migrations",
          "Features with uncertain technical approach",
          "Features with performance constraints"
        ]
      },
      {
        "pattern": "Independent tasks in parallel groups",
        "success_rate": 0.89,
        "applicable_scenarios": [
          "UI component development",
          "Service layer implementation",
          "Testing independent modules"
        ]
      }
    ],
    "ordering_rules": [
      {
        "rule": "Always place database schema changes in the first task group",
        "priority": "high",
        "confidence": 0.97,
        "supporting_evidence": 28
      },
      {
        "rule": "Backend API routes should precede frontend UI that consumes them",
        "priority": "high",
        "confidence": 0.94,
        "supporting_evidence": 22
      },
      {
        "rule": "Testing tasks should be placed after implementation completes",
        "priority": "medium",
        "confidence": 0.92,
        "supporting_evidence": 31
      },
      {
        "rule": "Documentation tasks can run in parallel with implementation if not blocking",
        "priority": "low",
        "confidence": 0.78,
        "supporting_evidence": 12
      },
      {
        "rule": "High-complexity tasks should not be grouped with more than 2-3 other parallel tasks",
        "priority": "medium",
        "confidence": 0.85,
        "supporting_evidence": 8
      },
      {
        "rule": "Tasks with external dependencies (API calls, third-party services) should be done early",
        "priority": "high",
        "confidence": 0.88,
        "supporting_evidence": 15
      }
    ],
    "anti_patterns": [
      {
        "pattern": "Frontend before backend when API doesn't exist",
        "reason": "Leads to refactoring when API contract is known",
        "negative_outcomes": [
          "Wasted effort on mock data integration",
          "API contract mismatches",
          "Increased integration time"
        ]
      },
      {
        "pattern": "Testing before implementation is complete",
        "reason": "Tests fail and require constant updates",
        "negative_outcomes": [
          "Fragile tests",
          "Developer frustration",
          "Increased test maintenance"
        ]
      },
      {
        "pattern": "Too many parallel tasks (>5) in a single group",
        "reason": "Context switching and integration complexity",
        "negative_outcomes": [
          "Merge conflicts",
          "Lost context",
          "Integration issues"
        ]
      },
      {
        "pattern": "Low-risk tasks before high-risk tasks",
        "reason": "High-risk failures discovered late require more rework",
        "negative_outcomes": [
          "Late-stage rollback",
          "Wasted effort on dependent tasks",
          "Schedule delays"
        ]
      }
    ],
    "category_best_practices": {
      "database": {
        "typical_position": "early",
        "parallel_safe": false,
        "dependencies": []
      },
      "backend_api": {
        "typical_position": "early",
        "parallel_safe": true,
        "dependencies": ["database"]
      },
      "frontend_ui": {
        "typical_position": "middle",
        "parallel_safe": true,
        "dependencies": ["backend_api"]
      },
      "testing": {
        "typical_position": "late",
        "parallel_safe": true,
        "dependencies": ["implementation"]
      },
      "documentation": {
        "typical_position": "flexible",
        "parallel_safe": true,
        "dependencies": []
      },
      "deployment": {
        "typical_position": "late",
        "parallel_safe": false,
        "dependencies": ["testing", "implementation"]
      }
    }
  }
}
